{"run":25,"commit":"HEAD","metric":86705.3,"metrics":{"sm_write_dura":44194.8,"sm_read_seq":2604.3,"lg_write_dura":14498.4,"sm_read_rnd":7529.9,"lg_read_seq":3192.3,"lg_read_rev":2220.7,"mod_write_dura":10849.9,"mod_read":1590.4,"sync_barrier":15.2},"status":"discard","description":"Try zstd level -5 (more negative than -3). Regression: 86,468→86,705ms (+0.3%). Level -3 is the sweet spot for this workload.","timestamp":1777708254803,"segment":0,"confidence":25.272260273972602,"asi":{"hypothesis":"Try zstd level -5 for even faster compression than -3.","rollback_reason":"Level -5 is 238ms slower than -3. Diminishing returns / different tradeoff point.","learned":"Level -3 is the sweet spot for this workload.","total_experiments":25,"experiments_kept":10}}
{"run":26,"commit":"HEAD","metric":86676.6,"metrics":{"sm_write_dura":43885.1,"sm_read_seq":2770.7,"lg_write_dura":14492.1,"sm_read_rnd":7549.2,"lg_read_seq":3171.1,"lg_read_rev":2467.8,"mod_write_dura":10751,"mod_read":1562.8,"sync_barrier":17.7},"status":"discard","description":"Increase FUSE attr/entry TTL from 150ms to 1000ms. Within noise (0.2% of best). Reverting to 150ms default.","timestamp":1777708411351,"segment":0,"confidence":26.02156856983334,"asi":{"hypothesis":"Increase FUSE TTLs to reduce kernel getattr/lookup traffic.","rollback_reason":"No measurable improvement (0.2%, within noise).","total_experiments":26,"experiments_kept":10}}
{"run":27,"commit":"7027853","metric":85654.7,"metrics":{"sm_write_dura":44033.8,"sm_read_seq":2687.5,"lg_write_dura":13748.6,"sm_read_rnd":7564.9,"lg_read_seq":3154,"lg_read_rev":2235.1,"mod_write_dura":10640.4,"mod_read":1569.3,"sync_barrier":11.2},"status":"keep","description":"Remove unnecessary clone in non-vault chunk path. Restructured to avoid cloning ready_chunk.chunk.compressed when we only need a reference. Saves ~814ms (0.9%). New best!","timestamp":1777708578923,"segment":0,"confidence":27.30900611713394,"asi":{"hypothesis":"Remove unnecessary Vec clone in chunk materialization non-vault path.","impact":"Saved ~814ms (0.9%). lg_write improved 3.6%, mod_write 1.2%.","total_experiments":27,"experiments_kept":11,"best_total_ms":85654.7,"improvement_from_baseline":"-34.5%"}}
{"run":28,"commit":"HEAD","metric":86011.1,"metrics":{"sm_write_dura":43525,"sm_read_seq":2646.9,"lg_write_dura":13819.9,"sm_read_rnd":7670.3,"lg_read_seq":3390.2,"lg_read_rev":2405.1,"mod_write_dura":10917.4,"mod_read":1610.8,"sync_barrier":16},"status":"discard","description":"Use Arc<Vec<u8>> in pending_chunks to avoid data_vec.clone(). Slight regression (86,011 vs 85,655). Arc refcount overhead offsets clone savings for this workload.","timestamp":1777708853470,"segment":0,"confidence":21.059713691880198,"asi":{"hypothesis":"Use Arc<Vec<u8>> in pending_chunks to share data between cache and compression, avoiding Vec clone.","rollback_reason":"Slight regression (+0.4%). Arc refcount overhead exceeds clone savings for 1MB chunks.","total_experiments":28,"experiments_kept":11}}
{"run":29,"commit":"HEAD","metric":86597.8,"metrics":{"sm_write_dura":44221.2,"sm_read_seq":2563,"lg_write_dura":14097.7,"sm_read_rnd":7649.8,"lg_read_seq":3013.1,"lg_read_rev":2606.1,"mod_write_dura":10837.2,"mod_read":1583,"sync_barrier":17},"status":"discard","description":"Try zstd level -7 (most negative/fastest). Regression: 85,655→86,598ms (+1.1%). Level -3 remains the sweet spot.","timestamp":1777709008204,"segment":0,"confidence":17.444251005880517,"asi":{"hypothesis":"Try zstd level -7 (most negative) for maximum compression speed.","rollback_reason":"Level -7 is 943ms slower than -3. Diminishing returns at extreme negative levels.","total_experiments":29,"experiments_kept":11}}
